{
    "schemaVersion": 4,
    "catalogVersion": 7,
    "minimumAppVersionCode": 16,
    "files": [
        {
            "path": "catalog.json",
            "objectPath": "objects/sha256/505efda03760b92e1b1fd76ef8a751885b54de94d6242008c81efed3c45eebfc",
            "bytes": 2165,
            "sha256": "505efda03760b92e1b1fd76ef8a751885b54de94d6242008c81efed3c45eebfc"
        },
        {
            "path": "moo1/1.3/profile.json",
            "objectPath": "objects/sha256/8b2b711d22d24c811bf97a88d715b2ba0e2eeceb368f8b674fe890dc9053f1b0",
            "bytes": 228117,
            "sha256": "8b2b711d22d24c811bf97a88d715b2ba0e2eeceb368f8b674fe890dc9053f1b0"
        },
        {
            "path": "moo1/cover.png",
            "objectPath": "objects/sha256/90487fbae03cd94876b9555ada85947c572ad1f15c783f249551965b70fdf872",
            "bytes": 22423,
            "sha256": "90487fbae03cd94876b9555ada85947c572ad1f15c783f249551965b70fdf872"
        },
        {
            "path": "moo1/intro.mp4",
            "objectPath": "objects/sha256/dece28149bb9db4b4e6e753f432d80cd67985c58512ca3c5af3b4cd9d3ac296b",
            "bytes": 6400559,
            "sha256": "dece28149bb9db4b4e6e753f432d80cd67985c58512ca3c5af3b4cd9d3ac296b"
        },
        {
            "path": "moo1/resolve.json",
            "objectPath": "objects/sha256/564bb2d0a99df75e2cba9da16898be9e8eb9427fef1b4c27b42000903c68f0e0",
            "bytes": 1118,
            "sha256": "564bb2d0a99df75e2cba9da16898be9e8eb9427fef1b4c27b42000903c68f0e0"
        },
        {
            "path": "moo1/star-map.png",
            "objectPath": "objects/sha256/6fce1d09c5f0ea46bf4bab5a21d3addb3ce0d88c11c0858a4800b396854be29c",
            "bytes": 11147,
            "sha256": "6fce1d09c5f0ea46bf4bab5a21d3addb3ce0d88c11c0858a4800b396854be29c"
        },
        {
            "path": "moo1/tech-breakthrough.png",
            "objectPath": "objects/sha256/7031e0d710fe8adcbfab216589c3bdcd967844e5dcd92b20205d976f8c3a9ea1",
            "bytes": 22419,
            "sha256": "7031e0d710fe8adcbfab216589c3bdcd967844e5dcd92b20205d976f8c3a9ea1"
        }
    ]
}
